<?xml version="1.0" encoding="UTF-8"?>
<result xmlns:xsi="http://www.w3.org/2001/XMLSchema-instance" xsi:noNamespaceSchemaLocation="retorno-entrada-ord.xsd">
  <version date="2001-01-01">0.0</version>
  <request-id>request-id</request-id>
  <state>succeeded</state>
  <payload>
    <identification>
      <metering-point id=""/>
      <device nr=""/>
      <datachannel obis-id-code=""/>
      <device-list>
        <device date-from="2001-12-31T12:00:00" date-to="2001-12-31T12:00:00" nr=""/>
      </device-list>
    </identification>
    <data>
      <time-frame date-from="" date-to="" ref-date-from=""/>
      <data-type>lp</data-type>
      <integration-period>0</integration-period>
      <unit>unit</unit>
      <plausibility>succeeded</plausibility>
      <value-list>
        <val dt="" lb="" st="" t1="" t2="" unit="">0.0</val>
      </value-list>
    </data>
  </payload>
</result>
